{
  "$schema": "https://json-schema.org/draft/2020-12/schema",
  "$id": "visual-set.schema.json",
  "title": "Slime Isa visual set",
  "type": "object",
  "additionalProperties": false,
  "required": ["visualSetId", "assetId", "defaults", "clips"],
  "properties": {
    "$schema": { "type": "string" },
    "visualSetId": {
      "type": "string",
      "pattern": "^[a-z0-9]+([.-][a-z0-9-]+)+$"
    },
    "assetId": {
      "type": "string",
      "pattern": "^[a-z0-9]+([.-][a-z0-9-]+)+$"
    },
    "defaults": { "$ref": "#/$defs/transform" },
    "frameVisuals": {
      "type": "object",
      "propertyNames": { "pattern": "^(0|[1-9][0-9]*)$" },
      "additionalProperties": { "$ref": "#/$defs/transform" }
    },
    "clips": {
      "type": "object",
      "minProperties": 1,
      "propertyNames": { "pattern": "^[a-z0-9]+([.-][a-z0-9-]+)*$" },
      "additionalProperties": { "$ref": "#/$defs/clip" }
    }
  },
  "$defs": {
    "pair": {
      "type": "array",
      "items": { "type": "number" },
      "minItems": 2,
      "maxItems": 2
    },
    "positivePair": {
      "type": "array",
      "items": { "type": "number", "exclusiveMinimum": 0 },
      "minItems": 2,
      "maxItems": 2
    },
    "originPair": {
      "type": "array",
      "items": { "type": "number", "minimum": 0, "maximum": 1 },
      "minItems": 2,
      "maxItems": 2
    },
    "transform": {
      "type": "object",
      "additionalProperties": false,
      "properties": {
        "origin": { "$ref": "#/$defs/originPair" },
        "scale": { "$ref": "#/$defs/positivePair" },
        "sourceOffset": { "$ref": "#/$defs/pair" }
      }
    },
    "clip": {
      "type": "object",
      "additionalProperties": false,
      "required": ["runtimeKey", "frames", "frameRate", "repeat"],
      "properties": {
        "runtimeKey": {
          "type": "string",
          "pattern": "^[a-z0-9]+([.-][a-z0-9-]+)*$"
        },
        "frames": {
          "type": "array",
          "minItems": 1,
          "items": { "type": "integer", "minimum": 0 }
        },
        "frameRate": { "type": "number", "exclusiveMinimum": 0 },
        "repeat": { "type": "integer", "minimum": -1 }
      }
    }
  }
}
