{
  "$schema": "../visual-set.schema.json",
  "visualSetId": "enemy.worm.brawler",
  "assetId": "enemy.worm.brawler",
  "defaults": { "origin": [0.5, 0.5], "scale": [1, 1], "sourceOffset": [0, 0] },
  "clips": {
    "idle-side": { "runtimeKey": "enemy-worm-brawler-idle-side", "frames": [0, 1, 2, 3], "frameRate": 6, "repeat": -1 },
    "walk-side": { "runtimeKey": "enemy-worm-brawler-walk-side", "frames": [4, 5, 6, 7], "frameRate": 10, "repeat": -1 },
    "attack-side": { "runtimeKey": "enemy-worm-brawler-attack-side", "frames": [8, 9, 10], "frameRate": 11, "repeat": 0 },
    "die-side": { "runtimeKey": "enemy-worm-brawler-die-side", "frames": [11, 12, 13], "frameRate": 7, "repeat": 0 },
    "idle-up": { "runtimeKey": "enemy-worm-brawler-idle-up", "frames": [14, 15, 16, 17], "frameRate": 6, "repeat": -1 },
    "walk-up": { "runtimeKey": "enemy-worm-brawler-walk-up", "frames": [18, 19, 20, 21], "frameRate": 10, "repeat": -1 },
    "attack-up": { "runtimeKey": "enemy-worm-brawler-attack-up", "frames": [22, 23, 24], "frameRate": 11, "repeat": 0 },
    "die-up": { "runtimeKey": "enemy-worm-brawler-die-up", "frames": [25, 26, 27], "frameRate": 7, "repeat": 0 },
    "idle-down": { "runtimeKey": "enemy-worm-brawler-idle-down", "frames": [28, 29, 30, 31], "frameRate": 6, "repeat": -1 },
    "walk-down": { "runtimeKey": "enemy-worm-brawler-walk-down", "frames": [32, 33, 34], "frameRate": 10, "repeat": -1 },
    "attack-down": { "runtimeKey": "enemy-worm-brawler-attack-down", "frames": [35, 36, 37, 38], "frameRate": 11, "repeat": 0 },
    "die-down": { "runtimeKey": "enemy-worm-brawler-die-down", "frames": [39, 40, 41, 42], "frameRate": 7, "repeat": 0 }
  }
}
